{
  "schema_version": "pr07.gpt55_structured_audit.output.v1",
  "audit_verdict": "ANOMALY_FOUND",
  "anomalies": [
    {
      "id": "EXAMPLE_ANOMALY_ONLY",
      "summary": "A bounded inconsistency was observed for human review."
    }
  ],
  "blocking_observations": [],
  "warnings": [
    "This simulated audit output is non-binding."
  ],
  "claim_language_findings": [
    "No claim authorization is made."
  ],
  "evidence_quality_findings": [
    "Mechanical outputs remain the primary inputs."
  ],
  "recommended_human_review": true,
  "forbidden_authority_attempts": [],
  "model_role": "non_binding_anomaly_critic",
  "reasoning_effort": "does_not_increase_authority",
  "authority_boundary": {
    "binding": false,
    "may_critique_anomalies": true,
    "may_authorize_merge": false,
    "may_authorize_promotion": false,
    "may_authorize_scientific_claims": false,
    "may_override_blocked": false,
    "may_increase_claim_scope": false,
    "may_transform_weak_evidence_into_proof": false,
    "reasoning_increases_authority": false,
    "reasoning_increases_permissions": false,
    "reasoning_increases_claim_scope": false
  },
  "truth_established": false,
  "merge_authorized": false,
  "promotion_authorized": false,
  "claim_authorized": false,
  "blocked_converted_to_pass": false,
  "claim_scope_increased": false,
  "software_verdict": "AUDIT_LAYER_ADDED",
  "evidence_verdict": "STRUCTURED_AUDIT_ONLY",
  "claim_verdict": "NO_CLAIM_ALLOWED"
}
